{
  "bundle_type": "cawg-trqp-audit-bundle",
  "bundle_profile": "https://example.org/profiles/cawg-trqp-audit-bundle/v1",
  "bundle_version": "1.1.0",
  "exported_at": "2026-03-31T00:00:00Z",
  "bundle_id": "urn:trqp:audit-bundle:sha256:09778b78d95610560821a3f0629c64d06c37c0e0776c52904332c725c7653ede",
  "request_summary": {
    "asset_id": "asset-001",
    "entity_id": "did:web:publisher.example",
    "authority_id": "did:web:media-registry.example",
    "issuer_id": "did:web:issuer.example",
    "action": "publish",
    "resource": "cawg:news-content",
    "context": {
      "jurisdiction": "IN",
      "credential_type": "vc:creator-identity",
      "risk_tier": "medium",
      "content_type": "image"
    },
    "has_process_evidence": true
  },
  "verification_result": {
    "asset_integrity": "verified",
    "assertion_binding": "verified",
    "issuer_recognition": "recognized",
    "actor_authorization": "authorized",
    "process_integrity": "verified_high",
    "policy_freshness": "current",
    "verification_mode": "cached_online",
    "trust_outcome": "trusted",
    "process_appraisal": {
      "status": "verified",
      "process_type": "human_assisted",
      "confidence": 0.91,
      "minimum_confidence": 0.75,
      "evidence_ref": "urn:example:pop:asset-001",
      "evidence_format": "application/cpop+cbor",
      "appraisal": "writers_authenticity_report",
      "reference": "https://github.com/LF-Decentralized-Trust-labs/proof-of-process"
    },
    "policy_evidence": {
      "authorization_evidence": [
        "registry-entry:publisher-123",
        "policy:media-publish-v2"
      ],
      "recognition_evidence": [
        "trust-list:issuer-77"
      ],
      "policy_epoch": "2026-Q1",
      "policy_requirements": {
        "requires_process_proof": true,
        "min_process_integrity": 0.75,
        "allowed_process_types": [
          "human_assisted",
          "verified_editorial_pipeline"
        ]
      }
    },
    "gateway_mediation": {},
    "explanations": [
      "Live authorization lookup executed",
      "Live recognition lookup executed"
    ]
  },
  "policy_evidence": {
    "authorization_evidence": [
      "registry-entry:publisher-123",
      "policy:media-publish-v2"
    ],
    "recognition_evidence": [
      "trust-list:issuer-77"
    ],
    "policy_epoch": "2026-Q1",
    "policy_requirements": {
      "requires_process_proof": true,
      "min_process_integrity": 0.75,
      "allowed_process_types": [
        "human_assisted",
        "verified_editorial_pipeline"
      ]
    }
  },
  "process_appraisal": {
    "status": "verified",
    "process_type": "human_assisted",
    "confidence": 0.91,
    "minimum_confidence": 0.75,
    "evidence_ref": "urn:example:pop:asset-001",
    "evidence_format": "application/cpop+cbor",
    "appraisal": "writers_authenticity_report",
    "reference": "https://github.com/LF-Decentralized-Trust-labs/proof-of-process"
  },
  "gateway_mediation": {},
  "replay_inputs": {
    "request": {
      "asset_id": "asset-001",
      "integrity_ok": true,
      "entity_id": "did:web:publisher.example",
      "authority_id": "did:web:media-registry.example",
      "issuer_id": "did:web:issuer.example",
      "action": "publish",
      "resource": "cawg:news-content",
      "context": {
        "jurisdiction": "IN",
        "credential_type": "vc:creator-identity",
        "risk_tier": "medium",
        "content_type": "image"
      },
      "process_evidence": {
        "verified": true,
        "process_type": "human_assisted",
        "confidence": 0.91,
        "evidence_ref": "urn:example:pop:asset-001",
        "evidence_format": "application/cpop+cbor",
        "appraisal": "writers_authenticity_report",
        "reference": "https://github.com/LF-Decentralized-Trust-labs/proof-of-process"
      }
    },
    "profile": "standard",
    "use_gateway": false,
    "verification_mode": "cached_online",
    "policy_epoch": "2026-Q1",
    "policy_feed": {
      "policy_source": "data/policies.json",
      "policy_source_sha256": "8396c9ccfed4aab0843716a3f23642e3fe2533858473246ba7c0729bff745e58",
      "revocation_source": "data/revocations.json",
      "revocation_source_sha256": "71c9bad31ad298ba7e8bd669255bcf0ab89ffeff7268d723b5a3af46eba7ce19"
    }
  },
  "bundle_digest_sha256": "260ed3f57bf9dc24f765f586d96dd65c698fd47e4491cce26768ac764f3c85ac"
}